<?xml version="1.0" encoding="UTF-8"?>
<osoby xsi:noNamespaceSchemaLocation="NewXMLSchema1.xsd"
	xmlns:xsi="http://www.w3.org/2001/XMLSchema-instance">
	<osoba plec="mezczyzna">
		<imie>Jan</imie>
		<nazwisko>Kowalski</nazwisko>
		<wiek>23</wiek>
	</osoba>
	<osoba plec="kobieta">
		<imie>Anna</imie>
		<nazwisko>Nowak</nazwisko>
		<wiek>23</wiek>
	</osoba>
</osoby>